ISSUE_ID,USER,DATE,COMMENT
LUCENE-7616, Trejkaz,03/Jan/17 02:19,"As an additional nasty point, sometimes this method is called from places like BooleanQueryNodeBuilder, where it goes into an error message to show the user. So this error message also shows the wrong syntax, but it also isn't immediately clear how a QueryNodeBuilder would know what syntax was used to create the QueryNode it has been passed..."
LUCENE-7629, Mike Drob,11/Jan/17 23:12,"I suspect it might be a JVM issue with nothing that we can do to fix it, but couldn't find any other JIRAs reporting the same thing so it made sense to create one."
LUCENE-7630, Uwe Schindler,13/Jan/17 12:51,"Hi, could you create a Pull Request and add the link here?

About your branch: I would not use cloneAttributes() because thats slow for this simple case. cloneAttributes() only helps if you want to modify the attributes in the AttributeSource that was created, but is not useful for simple save/restore use cases.

For your case, you should simple use captureState(), save the state object and then call restorestate() instead of clearAttributes(). After restoring you can adapt term text and positions/offsets. In addition when you clone or capture state, the call to clearAttributes() is useless and also slows down. When restoring states, everything is restored, so the additional clearing before is not needed."
LUCENE-7630, Nathan Gass,13/Jan/17 15:05,"I commited the suggested improvements and made a pull request https://github.com/apache/lucene-solr/pull/138.

The NGramTokenFilter probably has the same issue. I can port the fix to that class when everything is correct."
LUCENE-7630, Uwe Schindler,13/Jan/17 15:06,"The NGramTokenFilter probably has the same issue. I can port the fix to that class when everything is correct.

Please do! You can update the current PR. Otheriwise PR looks fine."
LUCENE-7630, Nathan Gass,13/Jan/17 16:48,done
LUCENE-7630, Uwe Schindler,16/Jan/17 08:55,"Thanks, I will merge and commit this after some testing!"
LUCENE-7630, Uwe Schindler,16/Jan/17 11:14,Thanks Nathan!
LUCENE-7631, Mike Drob,14/Jan/17 01:29,"Patch that ensures we won't add any new compiler warnings in several categories (that we're pretty good on already) in the future. We can deal with fixing existing rawtypes or a few other classes of warning in the future.

David Smiley - you seemed interested in this conversation last time it came up."
LUCENE-7631, David Smiley,16/Jan/17 16:41,Thanks for filing this issue!  Are all the changes in this patch necessary to get the build to pass?  So to clarify... no code (outside what the patch touches) needs adjustments?
LUCENE-7631, Mike Drob,16/Jan/17 17:38,"Yes, the build passes for me with only the two additional changes in WordDictionary and SimpleServer.

Warnings for -Xlint:-auxiliaryclass -Xlint:-deprecation -Xlint:-rawtypes -Xlint:-serial -Xlint:-unchecked are all disabled. Each of those causes a lot of errors that I'd like to see eventually followed up on. The auxiliary class warnings are the easiest of those, but still enough work that I felt like it should be a separate task.

I also have a sneaking suspicion that this only affects lucene and solr is somehow ignoring it, but couldn't find anything to confirm that."
LUCENE-7631, Uwe Schindler,16/Jan/17 18:43,"Thanks Mike!
I am for using this patch. Robert's suggestion was to enable ""all"" warnings, but IMHO this is a bad idea, because if somebody compiles with a later Java version, the build may suddenly fail (because a later version of the compiler added a new warning type).

I am not sure if the warning exclusions are really needed, because we no longer have the general -Xlint. But it's good to have them listed!

The only downside of this patch is that we no longer get any warnings displayed that are currently disabled (rawtypes, unchecked). So we should fix them asap (in a separate issue).

BTW: Maybe we can enable rawtypes and unchecked errors earlier in Lucene and leave them disabled in Solr. As far as I remember we already have a separate warning setting for Solr. This may be the reason why Solr does not show any problems!?"
LUCENE-7631, Uwe Schindler,16/Jan/17 18:44,"Yes on Solr your change is not enabled: https://github.com/apache/lucene-solr/blob/master/solr/common-build.xml#L30

We should also review Solr (maybe in a separate issue)."
LUCENE-7631, Mike Drob,20/Jan/17 22:58,"I am not sure if the warning exclusions are really needed, because we no longer have the general -Xlint. But it's good to have them listed!
Yea, I like having them listed because it makes it easier to go back and look at them and decide which ones to add.

I don't have access to an IBM jdk to check if that produces different output or not. Uwe Schindler - do you think this is fine to commit or we should tackle more work in this issue?"
LUCENE-7631, Uwe Schindler,21/Jan/17 08:51,"Hi,
IBM JDK8+ should also use OpenJDK internally, so I dont't think hit has much different options. I can try later, I have one installed.

What do we do with Solr? Keep it as it is (it overrides to do no Xlint warnings at all and don't fail on warning). Otherwise I am fine with committing this. But we should really work on removing unsafe and rawtypes warnings from functions module. Now those are completely undetected (no warning, no error)."
LUCENE-7635, Masaru Hasegawa,16/Jan/17 08:49,Here is a patch.
LUCENE-7635, Hoss Man,18/Jan/17 21:59,"i'm not very familiar with Kuromoji but i believe the lines you 're deleting in this patch are intended to catch comments at the end of a line – not just the begining, ie...


# comment at start of line

朝青龍,朝青龍,アサショウリュウ,カスタム人名 # end line comment, has a comma in it
                                   # spans more then one line
abcd,a b cd,foo1 foo2 foo3,bar     # Another end line comment



Since it seems like the intent of the UserDict format is to be ""CSV with '#' comments"" it seems like the comment stripping should be moved to o.a.l.analysis.ja.util.CSVUtil where it can be done if-and-only-if the '#' is not part of a quoted value...


朝青龍,朝青龍,アサショウリュウ,カスタム人名  # end line comment, has a comma in it
                                    # spans more then one line
abcd,a b cd,foo1 foo2 foo3,bar      # Another end line comment
""quoted#sharp"",other,""quoted,stuff"" # yet another end line comment



ie: add a if(c == '#' && !insideQuote) block (similar to the existing COMMA conditional) to CSVUtil.parse() that would (trim and) add the final value to result and break out of the for loop.

?"
LUCENE-7635, Masaru Hasegawa,24/Jan/17 02:11,"It was done long time ago. I don't remember original intention... But it doesn't seem to be common for dictionaries to have comments at the end of line (synonym, stop).
Wonder if it's better to follow the same rule."
LUCENE-7646, Michael McCandless,20/Jan/17 13:53,"Note that you can use {noformat} around code blocks here to preserve indendentation.

Can you post the NullPointerException?

Was this already fixed by LUCENE-7576?  Though your ""silly"" regexp (..) should have been a NORMAL case I think?

I turned your code fragment into a test case (will attach patch) and it doesn't hit an NPE ...."
LUCENE-7646, Michael McCandless,20/Jan/17 13:54,"Patch w/ test case, but it does not show the NPE..."
LUCENE-7646, Tom Mortimer,23/Jan/17 11:35,"Mike, thanks for the comments. I didn't notice that when I posted the code like that, it changed the regex from


.*.*


to


..


which doesn't cause a problem. I've since found the same problem with the ""non-silly"" expression 


.*



Exception in thread ""main"" java.lang.NullPointerException
	at org.apache.lucene.index.AutomatonTermsEnum.<init>(AutomatonTermsEnum.java:79)
	at RegExpNPE.main(RegExpNPE.java:20)"
LUCENE-7646, Tom Mortimer,23/Jan/17 12:04,I've just tried with 6.4 and it does indeed seem to have been fixed by LUCENE-7576. I'd not realised I was using the API incorrectly. Thanks!
LUCENE-7646, Michael McCandless,23/Jan/17 12:09,"Phew, thanks for bringing closure Tom Mortimer!"
LUCENE-7647, Adrien Grand,20/Jan/17 15:02,"Here is a patch. On the writing side, things are easy since there is a single instance that is used from a single thread and for a short amount of time, so I just made the compressor implement Closeable. However things are a bit more complicated on the reading side because of clones and the fact that we do not close them all. So to keep things simple, I just changed the codec to create Inflater instances on demand."
LUCENE-7647, Robert Muir,20/Jan/17 15:33,What does it do to performance to create a deflater instance every time? This seems very inefficient.
LUCENE-7647, Robert Muir,20/Jan/17 15:38,s/deflater/inflater of course
LUCENE-7647, Adrien Grand,20/Jan/17 15:47,"For fetching the top hits I think it is fine anyway, if there is an issue I suspect it would be more with merging. I can try to run luceneutil with this change next week. Do you have ideas to make it more efficient maybe?"
LUCENE-7647, Robert Muir,20/Jan/17 15:55,"I think its first important to understand how it impacts performance, including worst cases. That means merging with deletes and lots of results and stuff too: not just best-cases like top hits only.

Alternative solutions are possible depending on the impact: e.g. pool managed by the top Decompressor and passed via clone(), and decompress could simply release back to the pool. This is kind of a standard pattern, but of course it adds complexity. We should avoid it if its really not necessary."
LUCENE-7647, Adrien Grand,23/Jan/17 15:29,"I ran a merge that cantains 1M documents from the wikipedia benchmark including deleted docs, in order to test the worst case. Here is what the info stream reports about stored fields before/after the change:

Before:

SM 0 [2017-01-23T15:03:34.956Z; Lucene Merge Thread #0]: 41827 msec to merge stored fields [996093 docs]
SM 0 [2017-01-23T15:06:49.785Z; Lucene Merge Thread #0]: 41722 msec to merge stored fields [996093 docs]
SM 0 [2017-01-23T15:14:09.943Z; Lucene Merge Thread #0]: 42138 msec to merge stored fields [996093 docs]



After:

SM 0 [2017-01-23T15:17:33.241Z; Lucene Merge Thread #0]: 42050 msec to merge stored fields [996093 docs]
SM 0 [2017-01-23T15:20:00.656Z; Lucene Merge Thread #0]: 42320 msec to merge stored fields [996093 docs]
SM 0 [2017-01-23T15:22:04.047Z; Lucene Merge Thread #0]: 42520 msec to merge stored fields [996093 docs]



I think this is either noise a an acceptable slow down. That makes sense since we always decompress about 16K of data. Initialization of the Inflater is likely much less costly than decompressing that amount of data."
LUCENE-7647, Robert Muir,25/Jan/17 15:51,Thanks for running the benchmark!
LUCENE-7650, Otmar Caduff,21/Jan/17 11:49,Java file for reproducing the error.
LUCENE-7650, Mikhail Khludnev,30/Jan/17 14:43,"since Complexphraseqp parses query twice, you need escape it twice. That is."
LUCENE-7650, Otmar Caduff,31/Jan/17 16:24,"Thanks! That helped. Not an issue anymore for me.
I think it would make sense to add to ComplexPhraseQueryParser's javadoc the following comment (or something alike):

Special care has to be given when escaping: because some parts of the query might be parsed multiple times, these parts have to be escaped as often."
LUCENE-7651, Uwe Schindler,22/Jan/17 09:15,"I set to ""critical"", because this also breaks our latest release 6.4, which can't be build from source with Java 8 update 121."
LUCENE-7651, Uwe Schindler,22/Jan/17 09:16,I will try to figure out if moving the Javascript to a separate file helps here. In HTML 5 inline Javascript in HTML files is a no-go.
LUCENE-7651, Uwe Schindler,22/Jan/17 09:30,"I checked it out, it disallows any <script>, also externally linked ones in the -bottom parameter of Javadocs. This is amajor pain. As adding this special allow-javascript parameter is brekaing builds with older versions and its hard to detect the exact build version in Ant, we have 2 options:


	Remove prettify.js
	Inject the prettify code somehow else into the docs (e.g. by copying all script files together and append them to the javadoc-generated JS file after javadoc succeeds)."
LUCENE-7651, Uwe Schindler,22/Jan/17 09:35,"This implements first option:


 lucene/common-build.xml | 14 --------------
 1 file changed, 14 deletions(-)

diff --git a/lucene/common-build.xml b/lucene/common-build.xml
index 48cf457..61948bb 100644
--- a/lucene/common-build.xml
+++ b/lucene/common-build.xml
@@ -2107,20 +2107,6 @@ ${ant.project.name}.test.dependencies=${test.classpath.list}
         <link offline=""true"" href=""${javadoc.link}"" packagelistLoc=""${javadoc.packagelist.dir}/java8""/>
         <bottom><![CDATA[
           <i>Copyright &copy; ${year} Apache Software Foundation.  All Rights Reserved.</i>
-          <script src='{@docRoot}/prettify.js' type='text/javascript'></script>
-          <script type='text/javascript'>
-            (function(){
-              var oldonload = window.onload;
-              if (typeof oldonload != 'function') {
-                window.onload = prettyPrint;
-              } else {
-                window.onload = function() {
-                  oldonload();
-                  prettyPrint();
-                }
-              }
-            })();
-          </script>
         ]]></bottom>
         
         <sources />



I checked our sources. We allready append the CSS of prettify to Javadocs's main CSS files. As Java 8 contains also a Javadocs-generated scripts.js file, we could do the same here. I am working on that..."
LUCENE-7651, Uwe Schindler,22/Jan/17 09:46,This would be my proposal.
LUCENE-7651, Uwe Schindler,22/Jan/17 09:50,Sorry last patch had a missing pair of brackets. This fixes it any also works locally. Stupid Javascript! KRRRR!
LUCENE-7651, Uwe Schindler,22/Jan/17 10:12,"Attached is a patch that also updates Prettify to latest version. The used one produced Javascript errors in Chrome, so I updated. I also removed the useless additional language plugin files."
LUCENE-7651, Uwe Schindler,22/Jan/17 10:38,"Final updates, I think this is committable.

Any suggestions?"
LUCENE-7651, Uwe Schindler,22/Jan/17 11:16,Add correct license header to CSS file.
LUCENE-7651, Uwe Schindler,22/Jan/17 12:13,"I just checked. The ""hack"" also works with IBM J9, so I see no problem doing this. I was afraid that maybe IBM does not have script.js in the Javadoc output.

Nevertheless, this is not risky like the previous hack. If the Javadocs generator no longer produces script.js or stylesheet.css the Code Prettify would just no longer work, but not break Javadocs or build."
LUCENE-7651, Uwe Schindler,22/Jan/17 12:18,I sent the following message to OpenJDK: http://mail.openjdk.java.net/pipermail/javadoc-dev/2017-January/000281.html
LUCENE-7651, Uwe Schindler,22/Jan/17 17:31,"I committed this to master and branch_6x. I will now disable all 6.4 branch builds. If we will have a further bugfix release on this branch, we should backport this. Please reopen in that case."
LUCENE-7651, Uwe Schindler,22/Jan/17 17:32,"Fixed for now, please reopen for every bugfix release on any branch that was not yet updated to use this."
LUCENE-7651, Uwe Schindler,01/Feb/17 12:46,"BTW, the release notes of Java 8u121 was updated to mention this change: http://www.oracle.com/technetwork/java/javase/8u121-relnotes-3315208.html
It still breaks our previous releases, but we can tell people that its caused by Oracle, not us."
LUCENE-7651, Uwe Schindler,07/Feb/17 10:43,"I backported this change to Lucene 5.5.4, because otherwise we cannot run the build with Java 8 anymore. The problem is the following: Java 7's Javadocs do not add a ""script.js"" file to the Javadocs output, so this fix injects the javadocs, but because a ""script.js"" is nowhere referenced in the HTML files, prettyprint is not loaded.

We have the following possibilities:

	revert this backport commit, but it prevents smoketester from suceeding (as it checks also Java 8). It also makes it impossible to build the 5.5.4 release with Java 8
	add more hacks to inject a script tag into the head element, but that's really complicated as you have to do it in every HTML file!
	ignore the fact that Javadocs do not code-prettyprint correctly anymore in Java 7. The Javadocs are fine, just the code exaples are no longer syntax highlighted.



I'd go for the third item. Any comments? If we go this route, I will add a comment to the Changelog that prettyprinting Javadocs is no longer working, if docs are build with Java 7."
LUCENE-7651, Uwe Schindler,07/Feb/17 10:55,"We don't have access to recent paid only Java 7 JDKs, but as the Javadocs fix was declared a security issue, I assume that it is also applied to Java 7, so without this fix Java 7 paid updates will fail the build, too."
LUCENE-7652, Adrien Grand,23/Jan/17 13:36,"Can you also read what the value of LRUQueryCache.ramBytesUsed is?

LRUQueryCache has references to current open IndexReaders due to close listeners. I believe you are analysing a heap dump and recursively adding everything that is referenced by your LRUQueryCache while it does not make sense ot take open IndexReaders into account.

The keys of LRUQueryCache.cache are instances of SegmentCoreReaders, and I've checked many of the keys, the only reference to them is LRUQueryCache.cache, given LRUQueryCache.cache is an IdentityHashMap, that means you can't even get to them outside of the cache because you can't get a key that's equivalent to one of these in the cache.

This indicates that you are leaking index readers. When there are no readers that reference a segment anymore, that segment is closed, which triggers the eviction of all associated entries in the query cache. You should review your usage of Lucene to make sure that there is a call to close() for every index reader that you acquire."
LUCENE-7652, Lae,23/Jan/17 19:22,"Hi Adrien, ramBytesUsed is only ~500KB. Thanks for the info regarding leaking index readers, I'll try to track those down."
LUCENE-7652, Adrien Grand,25/Jan/17 15:01,Another possibility is that you are affected by this bug: https://issues.apache.org/jira/browse/LUCENE-7657.
LUCENE-7652, Adrien Grand,25/Jan/17 15:02,Closing now as this is either an IndexReader leak from the application side or a duplicate of LUCENE-7657.
LUCENE-7652, Lae,25/Jan/17 23:21,"I have found our application was indeed leaking, we basically have something like:

Directory dir = FSDirectory.open(path);
DirectoryReader reader = DirectoryReader.open(dir);


reader was closed after used but dir was never closed, therefore causing this leak.

I have not yet verified whether we are impacted by LUCENE-7657."
LUCENE-7657, Adrien Grand,24/Jan/17 09:54,"Here is a patch that makes sure the queries returned by Weight.getQuery() do not reference a TermContext. An alternative way to fix the issue would be to remove the reference from TermContext on the reader context, but it is not straightforward. Opinions welcome."
LUCENE-7657, Adrien Grand,24/Jan/17 10:22,"I was doing more testing and this patch does not work. We only unset the context in createWeight, so wrapper queries like BooleanQuery or ToParentBlockJoinQuery would still have a reference to the index reader if the wrap a TermQuery that has a TermContext. So I guess the only way would be to remove the reference from TermContext to the index readers."
LUCENE-7657, Adrien Grand,24/Jan/17 10:38,Here is a patch that removes the reader context reference from TermContext.
LUCENE-7657, Michael McCandless,24/Jan/17 17:43,"+1

Clever solution to factor out this Object identity; I wonder if we should fix IndexReader.getXXXCacheKey() similarly ... later!"
LUCENE-7662, Mike Drob,07/Feb/17 21:31,Michael McCandless - what do you think of this patch?
LUCENE-7662, Michael McCandless,08/Feb/17 10:52,"Thanks Mike Drob; I think this patch looks good, except it makes some tests angry, e.g.:


   [junit4]   2> NOTE: reproduce with: ant test  -Dtestcase=TestLucene62SegmentInfoFormat -Dtests.method=testRandomExceptions -Dtests.seed=F65CD1D4D104665D -Dtests.locale=zh -Dtests.timezone=Asia/Khandyga -Dtests.asserts=true -Dtests.file.encoding=US-ASCII
   [junit4] ERROR   0.03s J3 | TestLucene62SegmentInfoFormat.testRandomExceptions <<<
   [junit4]    > Throwable #1: org.apache.lucene.index.CorruptIndexException: Problem reading index. (resource=a random IOException (_e.cfe))
   [junit4]    > 	at __randomizedtesting.SeedInfo.seed([F65CD1D4D104665D:9E73BF104F0A3FFD]:0)
   [junit4]    > 	at org.apache.lucene.index.SegmentCoreReaders.<init>(SegmentCoreReaders.java:142)
   [junit4]    > 	at org.apache.lucene.index.SegmentReader.<init>(SegmentReader.java:74)
   [junit4]    > 	at org.apache.lucene.index.ReadersAndUpdates.getReader(ReadersAndUpdates.java:143)
   [junit4]    > 	at org.apache.lucene.index.ReadersAndUpdates.getReadOnlyClone(ReadersAndUpdates.java:195)
   [junit4]    > 	at org.apache.lucene.index.StandardDirectoryReader.open(StandardDirectoryReader.java:103)
   [junit4]    > 	at org.apache.lucene.index.IndexWriter.getReader(IndexWriter.java:473)
   [junit4]    > 	at org.apache.lucene.index.DirectoryReader.open(DirectoryReader.java:103)
   [junit4]    > 	at org.apache.lucene.index.BaseIndexFileFormatTestCase.testRandomExceptions(BaseIndexFileFormatTestCase.java:563)
   [junit4]    > 	at org.apache.lucene.index.BaseSegmentInfoFormatTestCase.testRandomExceptions(BaseSegmentInfoFormatTestCase.java:50)
   [junit4]    > 	at java.lang.Thread.run(Thread.java:745)
   [junit4]    > Caused by: java.nio.file.NoSuchFileException: a random IOException (_e.cfe)
   [junit4]    > 	at org.apache.lucene.store.MockDirectoryWrapper.maybeThrowIOExceptionOnOpen(MockDirectoryWrapper.java:575)
   [junit4]    > 	at org.apache.lucene.store.MockDirectoryWrapper.openInput(MockDirectoryWrapper.java:744)
   [junit4]    > 	at org.apache.lucene.store.Directory.openChecksumInput(Directory.java:119)
   [junit4]    > 	at org.apache.lucene.store.MockDirectoryWrapper.openChecksumInput(MockDirectoryWrapper.java:1072)
   [junit4]    > 	at org.apache.lucene.codecs.lucene50.Lucene50CompoundReader.readEntries(Lucene50CompoundReader.java:105)
   [junit4]    > 	at org.apache.lucene.codecs.lucene50.Lucene50CompoundReader.<init>(Lucene50CompoundReader.java:69)
   [junit4]    > 	at org.apache.lucene.codecs.lucene50.Lucene50CompoundFormat.getCompoundReader(Lucene50CompoundFormat.java:71)
   [junit4]    > 	at org.apache.lucene.index.SegmentCoreReaders.<init>(SegmentCoreReaders.java:99)
   [junit4]    > 	... 44 more



Maybe we just need to relax that base test case to accept the new CorruptIndexExcpeption as well, and look to its cause to check the exception message?

Also, I think it'd be a bit better to use our expectThrows method in the test case, wrapped around the one line where you try to open an index reader, instead of the @Test(expected = ...), which would pass if CorruptIndexException was hit anywhere in that test case?"
LUCENE-7662, Mike Drob,08/Feb/17 20:57,"Those are good suggestions, I'll get them into the next version of this patch.

Looking at the code in MockDirectoryWrapper, some of the ""a random IOException"" stuff looks really hackish, especially where we are checking for string messages to match. I'm uncomfortable with how brittle some of that is. We already have FakeIOException available and I think it would be good to use that instead in several places. Do you think we should handle that here, or I can file a new issue for it."
LUCENE-7662, Mike Drob,08/Feb/17 22:55,Updated patch with some test clean up.
LUCENE-7662, Michael McCandless,09/Feb/17 00:20,"Thanks Mike Drob, the new patch looks great, and +1 to do that test cleanup here.  I'll push soon!"
